{
  "blocked_repairs": [
    {
      "blocked_reason": "Route governance deferred semantic acceptance for a generated candidate; the generated Rust remains candidate evidence.",
      "candidate_patch_id": "patch-route-refused-1",
      "candidate_routes": [
        {
          "next_action": "extend_typed_ir_lowering_or_emitter",
          "route": "typed_ir",
          "status": "blocked"
        },
        {
          "next_action": "generate_or_attach_baseline_output_then_run_common_validation",
          "route": "c2rust",
          "status": "candidate_context_only"
        },
        {
          "next_action": "generate_candidate_from_bound_inputs_then_run_common_validation",
          "route": "llm",
          "status": "candidate_only"
        },
        {
          "next_action": "write_reviewed_candidate_and_bind_it_to_oracle_diff_gates",
          "route": "manual",
          "status": "allowed_with_review"
        }
      ],
      "forbidden_change": "unsupported_control_flow",
      "human_action_required": true,
      "human_intervention_point": "Bind the generated candidate to the required oracle, diff, negative, unsafe, and final verification gates before promoting it.",
      "ir_feature_gap": {
        "evidence_refs": [
          "validation/evidence/zlib-ng/auto-translation/adler32-step/l3-adler32-step-route-decision.json"
        ],
        "kind": "typed_ir_zero_token_deterministic",
        "source": "route_decision.rationale"
      },
      "oracle_fixture_gap": {
        "reason": "Generated candidate evidence exists, but oracle/diff/negative/unsafe gates still control semantic acceptance.",
        "status": "not_blocking"
      },
      "repair_id": "repair-route-refused-1",
      "route_decision": "L4",
      "smallest_next_test": {
        "command": "python -B -m unittest validation.tools.test_auto_migrate.AutoMigrateTests.test_unsupported_lvalue_blocks_auto_migrate_candidate_generation",
        "expected_gate": "self-healing-blocked-repairs records repair playbook fields",
        "kind": "route_refusal_regression"
      },
      "source_span": {
        "file": "validation/evidence/zlib-ng/auto-translation/adler32-step/l3-adler32-step-rust-draft.rs",
        "line_end": 1,
        "line_start": 1
      }
    }
  ],
  "cache_invalidation_keys": [
    "source_commit=d40f29fd42ed9158e3eb3e221dca50e4b627f7a8",
    "fixture_hash=zlib-adler32-fixture",
    "patch_plan_schema=1"
  ],
  "schema_version": 1,
  "slice_id": "adler32-step",
  "status": "recorded",
  "target_id": "zlib-ng"
}
